{
  "slug": "sim",
  "name": "Sim",
  "description": "Sim is a powerful, user-friendly platform that allows developers and agents to build, test, and optimize agentic workflows.",
  "website": "https://sim.ai",
  "category": "ai-other",
  "founded_year": 2026,
  "headquarters": {
    "city": "Unknown",
    "country": "Unknown"
  },
  "meta": {
    "added_date": "2026-02-12",
    "last_updated": "2026-02-12",
    "sources": [
      "https://github.com/simstudioai"
    ],
    "data_quality_score": 0.4
  },
  "tags": [
    "open-source"
  ],
  "social": {
    "github": "https://github.com/simstudioai",
    "twitter": "simdotai"
  },
  "open_source": true,
  "status": "active"
}
