{
  "slug": "anthropic",
  "name": "Anthropic",
  "name_zh": "Anthropic",
  "description": "Anthropic is an AI safety company building reliable, interpretable, and steerable AI systems. Creator of the Claude family of AI assistants.",
  "description_zh": "Anthropic 是一家 AI 安全公司，致力于构建可靠、可解释、可控的 AI 系统。Claude 系列 AI 助手的创造者。",
  "website": "https://www.anthropic.com",
  "category": "llm-foundation-model",
  "tags": [
    "generative-ai",
    "nlp",
    "transformer",
    "api-platform",
    "chatbot",
    "b2b"
  ],
  "founded_year": 2021,
  "headquarters": {
    "city": "San Francisco",
    "state": "California",
    "country": "United States",
    "country_code": "US"
  },
  "funding": {
    "total_raised_usd": 7300000000,
    "last_round": "series-d",
    "last_round_date": "2024-03-27",
    "valuation_usd": 18400000000,
    "investors": [
      "Google",
      "Amazon",
      "Spark Capital",
      "Salesforce Ventures"
    ]
  },
  "team": {
    "employee_count_range": "501-1000",
    "founders": [
      {
        "name": "Dario Amodei",
        "title": "CEO"
      },
      {
        "name": "Daniela Amodei",
        "title": "President"
      }
    ]
  },
  "social": {
    "github": "https://github.com/anthropics",
    "twitter": "@AnthropicAI",
    "linkedin": "https://linkedin.com/company/anthropicresearch",
    "crunchbase": "https://www.crunchbase.com/organization/anthropic"
  },
  "products": [
    {
      "name": "Claude",
      "description": "AI assistant for work and conversation",
      "url": "https://claude.ai"
    },
    {
      "name": "Claude API",
      "description": "API for building with Claude models",
      "url": "https://docs.anthropic.com"
    }
  ],
  "open_source": false,
  "status": "active",
  "meta": {
    "added_date": "2026-02-11",
    "last_updated": "2026-02-11",
    "sources": [
      "https://www.anthropic.com"
    ],
    "data_quality_score": 0.8
  }
}