{
  "slug": "norbert-health",
  "name": "Norbert Health",
  "description": "Norbert Health is an AI company.",
  "website": "",
  "category": "ai-image-video",
  "founded_year": 2026,
  "headquarters": {
    "city": "Brooklyn",
    "country": "NY1 month ago"
  },
  "meta": {
    "added_date": "2026-02-12",
    "last_updated": "2026-02-12",
    "sources": [
      "https://www.linkedin.com/jobs"
    ],
    "data_quality_score": 0.4
  },
  "tags": [
    "linkedin"
  ],
  "status": "active"
}
