{
  "slug": "runway",
  "name": "Runway",
  "name_zh": "Runway",
  "description": "Runway is an applied AI research company building the next generation of creative tools powered by machine learning.",
  "description_zh": "Runway 是一家应用 AI 研究公司，构建下一代由机器学习驱动的创意工具。",
  "website": "https://runwayml.com",
  "category": "ai-image-video",
  "tags": [
    "generative-ai",
    "text-to-video",
    "text-to-image",
    "content-creation"
  ],
  "founded_year": 2018,
  "headquarters": {
    "city": "New York",
    "state": "New York",
    "country": "United States",
    "country_code": "US"
  },
  "funding": {
    "total_raised_usd": 237000000,
    "last_round": "series-c",
    "last_round_date": "2023-06-29",
    "valuation_usd": 1500000000,
    "investors": [
      "Google",
      "Nvidia",
      "Salesforce Ventures",
      "Felicis Ventures"
    ]
  },
  "team": {
    "employee_count_range": "51-200",
    "founders": [
      {
        "name": "Cristobal Valenzuela",
        "title": "CEO"
      },
      {
        "name": "Alejandro Matamala",
        "title": "Co-founder"
      },
      {
        "name": "Anastasis Germanidis",
        "title": "Co-founder"
      }
    ]
  },
  "social": {
    "github": "https://github.com/runwayml",
    "twitter": "@runaborayml",
    "linkedin": "https://linkedin.com/company/runwayml",
    "crunchbase": "https://www.crunchbase.com/organization/runway-ai"
  },
  "products": [
    {
      "name": "Gen-3 Alpha",
      "description": "AI video generation model",
      "url": "https://runwayml.com"
    },
    {
      "name": "Runway Studio",
      "description": "AI-powered video editing tools",
      "url": "https://runwayml.com"
    }
  ],
  "open_source": false,
  "status": "active",
  "meta": {
    "added_date": "2026-02-11",
    "last_updated": "2026-02-11",
    "sources": [
      "https://runwayml.com"
    ],
    "data_quality_score": 0.8
  }
}