{
  "slug": "blank-bio-yc-s25",
  "name": "Blank Bio (YC S25)",
  "description": "Blank Bio (YC S25) is an AI company.",
  "website": "",
  "category": "ai-other",
  "founded_year": 2026,
  "headquarters": {
    "city": "San Francisco",
    "country": "CA4 months ago"
  },
  "meta": {
    "added_date": "2026-02-12",
    "last_updated": "2026-02-12",
    "sources": [
      "https://www.linkedin.com/jobs"
    ],
    "data_quality_score": 0.4
  },
  "tags": [
    "linkedin"
  ],
  "status": "active"
}
