{
  "slug": "labmlai",
  "name": "labml.ai",
  "description": "Tools to help deep learning researchers",
  "website": "https://labml.ai",
  "category": "ai-other",
  "founded_year": 2026,
  "headquarters": {
    "city": "Unknown",
    "country": "Unknown"
  },
  "meta": {
    "added_date": "2026-02-12",
    "last_updated": "2026-02-12",
    "sources": [
      "https://github.com/labmlai"
    ],
    "data_quality_score": 0.4
  },
  "tags": [
    "open-source"
  ],
  "social": {
    "github": "https://github.com/labmlai",
    "twitter": "labmlai"
  },
  "open_source": true,
  "status": "active"
}
