{
  "slug": "flowiseai",
  "name": "FlowiseAI",
  "description": "Build AI Agents, Visually",
  "website": "https://flowiseai.com",
  "category": "ai-other",
  "founded_year": 2026,
  "headquarters": {
    "city": "Unknown",
    "country": "Unknown"
  },
  "meta": {
    "added_date": "2026-02-12",
    "last_updated": "2026-02-12",
    "sources": [
      "https://github.com/FlowiseAI"
    ],
    "data_quality_score": 0.4
  },
  "tags": [
    "open-source"
  ],
  "social": {
    "github": "https://github.com/FlowiseAI",
    "twitter": "FlowiseAI"
  },
  "open_source": true,
  "status": "active"
}
