{
  "slug": "ecosave",
  "name": "Ecosave",
  "description": "Ecosave is an AI company.",
  "website": "",
  "category": "ai-other",
  "founded_year": 2026,
  "headquarters": {
    "city": "Philadelphia",
    "country": "PAActively Hiring\n             +8Â benefits2 weeks ago"
  },
  "meta": {
    "added_date": "2026-02-12",
    "last_updated": "2026-02-12",
    "sources": [
      "https://www.linkedin.com/jobs"
    ],
    "data_quality_score": 0.4
  },
  "tags": [
    "linkedin"
  ],
  "status": "active"
}
