{
  "slug": "analytica",
  "name": "Analytica",
  "description": "Analytica is an AI company.",
  "website": "",
  "category": "ai-infrastructure",
  "founded_year": 2026,
  "headquarters": {
    "city": "Washington",
    "country": "DCBe an early applicant3 weeks ago"
  },
  "meta": {
    "added_date": "2026-02-12",
    "last_updated": "2026-02-12",
    "sources": [
      "https://www.linkedin.com/jobs"
    ],
    "data_quality_score": 0.4
  },
  "tags": [
    "linkedin"
  ],
  "status": "active"
}
