{
  "slug": "tensorflow",
  "name": "tensorflow",
  "description": "An Open Source Machine Learning Framework for Everyone",
  "website": "http://www.tensorflow.org",
  "category": "ai-other",
  "founded_year": 2026,
  "headquarters": {
    "city": "Unknown",
    "country": "Unknown"
  },
  "meta": {
    "added_date": "2026-02-12",
    "last_updated": "2026-02-12",
    "sources": [
      "https://github.com/tensorflow"
    ],
    "data_quality_score": 0.4
  },
  "tags": [
    "open-source"
  ],
  "social": {
    "github": "https://github.com/tensorflow"
  },
  "open_source": true,
  "status": "active"
}
