{
  "slug": "bright-vision-technologies",
  "name": "Bright Vision Technologies",
  "description": "Bright Vision Technologies is an AI company.",
  "website": "",
  "category": "ai-other",
  "founded_year": 2026,
  "headquarters": {
    "city": "Philadelphia",
    "country": "PABe an early applicant2 days ago"
  },
  "meta": {
    "added_date": "2026-02-12",
    "last_updated": "2026-02-12",
    "sources": [
      "https://www.linkedin.com/jobs"
    ],
    "data_quality_score": 0.4
  },
  "tags": [
    "linkedin"
  ],
  "status": "active"
}
