{
  "slug": "microsoft",
  "name": "Microsoft",
  "description": "Open source projects and samples from Microsoft",
  "website": "https://opensource.microsoft.com",
  "category": "ai-other",
  "founded_year": 2026,
  "headquarters": {
    "city": "Redmond, WA",
    "country": "Unknown"
  },
  "meta": {
    "added_date": "2026-02-12",
    "last_updated": "2026-02-12",
    "sources": [
      "https://github.com/microsoft"
    ],
    "data_quality_score": 0.4
  },
  "tags": [
    "open-source"
  ],
  "social": {
    "github": "https://github.com/microsoft",
    "twitter": "OpenAtMicrosoft"
  },
  "open_source": true,
  "status": "active"
}
