{
  "slug": "shield-ai",
  "name": "Shield AI",
  "name_zh": "Shield AI",
  "description": "Shield AI builds AI-powered defense technology including autonomous drones and intelligent pilot systems.",
  "description_zh": "Shield AI 构建 AI 驱动的国防技术，包括自主无人机和智能飞行员系统。",
  "website": "https://shield.ai",
  "category": "ai-security-defense",
  "tags": [
    "drone",
    "defense",
    "reinforcement-learning",
    "edge-ai"
  ],
  "founded_year": 2015,
  "headquarters": {
    "city": "San Diego",
    "state": "California",
    "country": "United States",
    "country_code": "US"
  },
  "funding": {
    "total_raised_usd": 900000000,
    "last_round": "series-f",
    "valuation_usd": 2700000000,
    "investors": [
      "Andreessen Horowitz",
      "Point72",
      "Snowflake Ventures"
    ]
  },
  "team": {
    "employee_count_range": "501-1000",
    "founders": [
      {
        "name": "Ryan Tseng",
        "title": "CEO"
      },
      {
        "name": "Brandon Tseng",
        "title": "President"
      }
    ]
  },
  "social": {
    "twitter": "@ShieldAI",
    "linkedin": "https://linkedin.com/company/shield-ai",
    "crunchbase": "https://www.crunchbase.com/organization/shield-ai"
  },
  "products": [
    {
      "name": "Hivemind",
      "description": "AI pilot for autonomous aircraft",
      "url": "https://shield.ai/hivemind"
    },
    {
      "name": "V-BAT",
      "description": "Autonomous VTOL drone",
      "url": "https://shield.ai/v-bat"
    }
  ],
  "open_source": false,
  "status": "active",
  "meta": {
    "added_date": "2026-02-11",
    "last_updated": "2026-02-11",
    "sources": [
      "https://shield.ai"
    ],
    "data_quality_score": 0.8
  }
}