{
  "slug": "mistral-ai",
  "name": "Mistral AI",
  "name_zh": "Mistral AI",
  "description": "Mistral AI is a French AI company building open and portable generative AI models. Known for efficient, open-weight models.",
  "description_zh": "Mistral AI 是一家法国 AI 公司，构建开放和便携的生成式 AI 模型。以高效开源模型闻名。",
  "website": "https://mistral.ai",
  "category": "llm-foundation-model",
  "tags": [
    "generative-ai",
    "nlp",
    "transformer",
    "open-source",
    "api-platform",
    "europe"
  ],
  "founded_year": 2023,
  "headquarters": {
    "city": "Paris",
    "country": "France",
    "country_code": "FR"
  },
  "funding": {
    "total_raised_usd": 2000000000,
    "last_round": "series-b",
    "last_round_date": "2024-06-11",
    "valuation_usd": 6000000000,
    "investors": [
      "Andreessen Horowitz",
      "General Catalyst",
      "Lightspeed Venture Partners"
    ]
  },
  "team": {
    "employee_count_range": "51-200",
    "founders": [
      {
        "name": "Arthur Mensch",
        "title": "CEO"
      },
      {
        "name": "Timothee Lacroix",
        "title": "CTO"
      },
      {
        "name": "Guillaume Lample",
        "title": "Chief Scientist"
      }
    ]
  },
  "social": {
    "github": "https://github.com/mistralai",
    "twitter": "@MistralAI",
    "linkedin": "https://linkedin.com/company/mistral-ai",
    "crunchbase": "https://www.crunchbase.com/organization/mistral-ai"
  },
  "products": [
    {
      "name": "Mistral Large",
      "description": "Flagship large language model",
      "url": "https://mistral.ai"
    },
    {
      "name": "Le Chat",
      "description": "Conversational AI assistant",
      "url": "https://chat.mistral.ai"
    }
  ],
  "open_source": true,
  "status": "active",
  "meta": {
    "added_date": "2026-02-11",
    "last_updated": "2026-02-11",
    "sources": [
      "https://mistral.ai"
    ],
    "data_quality_score": 0.8
  }
}