{
  "slug": "pika",
  "name": "Pika",
  "name_zh": "Pika",
  "description": "Pika is an AI company building tools to make video creation accessible for everyone through generative AI technology.",
  "description_zh": "Pika 是一家 AI 公司，通过生成式 AI 技术让每个人都能轻松创作视频。",
  "website": "https://pika.art",
  "category": "ai-image-video",
  "tags": [
    "generative-ai",
    "text-to-video",
    "content-creation",
    "b2c"
  ],
  "founded_year": 2023,
  "headquarters": {
    "city": "Palo Alto",
    "state": "California",
    "country": "United States",
    "country_code": "US"
  },
  "funding": {
    "total_raised_usd": 135000000,
    "last_round": "series-a",
    "investors": [
      "Spark Capital",
      "Lightspeed Venture Partners"
    ]
  },
  "team": {
    "employee_count_range": "11-50",
    "founders": [
      {
        "name": "Demi Guo",
        "title": "CEO"
      },
      {
        "name": "Chenlin Meng",
        "title": "CTO"
      }
    ]
  },
  "social": {
    "twitter": "@paborika_labs"
  },
  "products": [
    {
      "name": "Pika",
      "description": "AI video generation platform",
      "url": "https://pika.art"
    }
  ],
  "open_source": false,
  "status": "active",
  "meta": {
    "added_date": "2026-02-11",
    "last_updated": "2026-02-11",
    "sources": [
      "https://pika.art"
    ],
    "data_quality_score": 0.8
  }
}